{
  "$schema": "https://json-schema.org/draft/2020-12/schema",
  "$id": "https://ona-protocol.org/schemas/v1/energy-timeseries.json",
  "title": "ODS-E Energy Timeseries",
  "description": "Standardized energy reading from IoT devices, supporting generation, consumption, and net metering",
  "type": "object",
  "required": ["timestamp", "kWh", "error_type"],
  "properties": {
    "asset_id": {
      "type": "string",
      "description": "Asset identifier the record belongs to (asset-metadata asset_id or OEM serial number)"
    },
    "timestamp": {
      "type": "string",
      "format": "date-time",
      "description": "ISO 8601 timestamp with timezone"
    },
    "kWh": {
      "type": "number",
      "description": "Active energy in kilowatt-hours. Must be >= 0 for generation and consumption; may be negative for net direction."
    },
    "error_type": {
      "type": "string",
      "enum": ["normal", "warning", "critical", "fault", "offline", "standby", "unknown"],
      "description": "Standardized error classification"
    },
    "error_code": {
      "type": "string",
      "description": "Original OEM error code (preserved for reference)"
    },
    "oem_error_code": {
      "type": "string",
      "description": "Additional OEM status or fault code beyond error_code, as reported by the device API"
    },
    "kVArh": {
      "type": "number",
      "description": "Reactive energy in kilovolt-ampere reactive hours"
    },
    "kVA": {
      "type": "number",
      "minimum": 0,
      "description": "Apparent power in kilovolt-amperes"
    },
    "PF": {
      "type": "number",
      "minimum": 0,
      "maximum": 1,
      "description": "Power factor"
    },
    "kW": {
      "type": "number",
      "description": "Active power in kilowatts at the measurement interval"
    },
    "kVAr": {
      "type": "number",
      "description": "Reactive power in kilovars at the measurement interval"
    },
    "voltage_ac": {
      "type": "number",
      "minimum": 0,
      "description": "Aggregate AC voltage in volts; mean across phases when per-phase fields are present"
    },
    "voltage_ac_l1": {
      "type": "number",
      "minimum": 0,
      "description": "Phase L1 (A) AC voltage in volts"
    },
    "voltage_ac_l2": {
      "type": "number",
      "minimum": 0,
      "description": "Phase L2 (B) AC voltage in volts"
    },
    "voltage_ac_l3": {
      "type": "number",
      "minimum": 0,
      "description": "Phase L3 (C) AC voltage in volts"
    },
    "current_ac": {
      "type": "number",
      "minimum": 0,
      "description": "Aggregate AC current in amperes; sum across phases when per-phase fields are present"
    },
    "current_ac_l1": {
      "type": "number",
      "minimum": 0,
      "description": "Phase L1 (A) AC current in amperes"
    },
    "current_ac_l2": {
      "type": "number",
      "minimum": 0,
      "description": "Phase L2 (B) AC current in amperes"
    },
    "current_ac_l3": {
      "type": "number",
      "minimum": 0,
      "description": "Phase L3 (C) AC current in amperes"
    },
    "frequency": {
      "type": "number",
      "minimum": 0,
      "description": "Grid frequency in hertz"
    },
    "voltage_dc": {
      "type": "number",
      "minimum": 0,
      "description": "DC (string or circuit) voltage in volts"
    },
    "current_dc": {
      "type": "number",
      "minimum": 0,
      "description": "DC current in amperes"
    },
    "temperature": {
      "type": "number",
      "description": "Device (e.g. inverter) temperature in degrees Celsius"
    },
    "ambient_temperature_c": {
      "type": "number",
      "description": "Ambient air temperature in degrees Celsius"
    },
    "module_temperature_c": {
      "type": "number",
      "description": "PV module temperature in degrees Celsius"
    },
    "poa_irradiance": {
      "type": "number",
      "minimum": 0,
      "description": "Plane-of-array irradiance in watts per square meter"
    },
    "ghi": {
      "type": "number",
      "minimum": 0,
      "description": "Global horizontal irradiance in watts per square meter"
    },
    "dni": {
      "type": "number",
      "minimum": 0,
      "description": "Direct normal irradiance in watts per square meter"
    },
    "dhi": {
      "type": "number",
      "minimum": 0,
      "description": "Diffuse horizontal irradiance in watts per square meter"
    },
    "direction": {
      "type": "string",
      "enum": ["generation", "consumption", "net"],
      "default": "generation",
      "description": "Energy flow direction. Defaults to 'generation' for backward compatibility."
    },
    "end_use": {
      "type": "string",
      "enum": [
        "cooling", "heating", "fans", "pumps", "water_systems",
        "interior_lighting", "exterior_lighting", "interior_equipment",
        "refrigeration", "cooking", "laundry", "ev_charging",
        "pv_generation", "battery_storage", "whole_building", "other"
      ],
      "description": "End-use category aligned with ComStock/ResStock end-use breakdowns"
    },
    "fuel_type": {
      "type": "string",
      "enum": ["electricity", "natural_gas", "propane", "fuel_oil", "other"],
      "description": "Fuel type for non-electric assets"
    },
    "seller_party_id": {
      "type": "string",
      "pattern": "^[a-z0-9._-]+:[a-z0-9._-]+:[a-zA-Z0-9._-]+$",
      "description": "Canonical seller identifier in authority:type:id format."
    },
    "buyer_party_id": {
      "type": "string",
      "pattern": "^[a-z0-9._-]+:[a-z0-9._-]+:[a-zA-Z0-9._-]+$",
      "description": "Canonical buyer identifier in authority:type:id format."
    },
    "network_operator_id": {
      "type": "string",
      "pattern": "^[a-z0-9._-]+:[a-z0-9._-]+:[a-zA-Z0-9._-]+$",
      "description": "Canonical network operator identifier in authority:type:id format."
    },
    "wheeling_agent_id": {
      "type": "string",
      "pattern": "^[a-z0-9._-]+:[a-z0-9._-]+:[a-zA-Z0-9._-]+$",
      "description": "Canonical wheeling/intermediary identifier in authority:type:id format."
    },
    "settlement_period_start": {
      "type": "string",
      "format": "date-time",
      "description": "Settlement period start in ISO 8601 format."
    },
    "settlement_period_end": {
      "type": "string",
      "format": "date-time",
      "description": "Settlement period end in ISO 8601 format."
    },
    "loss_factor": {
      "type": "number",
      "minimum": 0,
      "description": "Applied loss factor for settlement (for example 0.03 for 3%)."
    },
    "contract_reference": {
      "type": "string",
      "description": "Contract or schedule reference (PPA, bilateral deal, or wheeling schedule)."
    },
    "tariff_schedule_id": {
      "type": "string",
      "pattern": "^[a-z0-9._-]+:[a-zA-Z0-9._-]+:[a-zA-Z0-9._-]+:v[0-9]+$",
      "description": "Canonical tariff schedule identifier in authority:municipality:code:vN format."
    },
    "tariff_period": {
      "type": "string",
      "enum": ["peak", "standard", "off_peak", "critical_peak"],
      "description": "Tariff period classification for the interval."
    },
    "tariff_currency": {
      "type": "string",
      "pattern": "^[A-Z]{3}$",
      "description": "ISO 4217 currency code for tariff components."
    },
    "tariff_version_effective_at": {
      "type": "string",
      "format": "date-time",
      "description": "Timestamp when the tariff version became effective."
    },
    "energy_charge_component": {
      "type": "number",
      "minimum": 0,
      "description": "Energy charge amount applied to this interval."
    },
    "network_charge_component": {
      "type": "number",
      "minimum": 0,
      "description": "Network charge amount applied to this interval."
    },
    "wheeling_type": {
      "type": "string",
      "enum": ["traditional", "virtual", "portfolio"],
      "description": "Wheeling model for this transaction."
    },
    "injection_point_id": {
      "type": "string",
      "description": "Grid injection point identifier for the wheeling path."
    },
    "offtake_point_id": {
      "type": "string",
      "description": "Grid offtake point identifier for the wheeling path."
    },
    "wheeling_status": {
      "type": "string",
      "enum": ["provisional", "confirmed", "reconciled", "disputed"],
      "description": "Reconciliation status of this wheeling record."
    },
    "wheeling_path_id": {
      "type": "string",
      "description": "Reference to a registered wheeling path or schedule."
    },
    "generation_charge_component": {
      "type": "number",
      "minimum": 0,
      "description": "Unbundled generation charge for this interval."
    },
    "transmission_charge_component": {
      "type": "number",
      "minimum": 0,
      "description": "Transmission use-of-system charge for this interval."
    },
    "distribution_charge_component": {
      "type": "number",
      "minimum": 0,
      "description": "Distribution network charge for this interval."
    },
    "ancillary_service_charge_component": {
      "type": "number",
      "minimum": 0,
      "description": "Ancillary services levy for this interval."
    },
    "non_bypassable_charge_component": {
      "type": "number",
      "minimum": 0,
      "description": "Non-bypassable charges for this interval (cross-subsidies, FBE contributions)."
    },
    "environmental_levy_component": {
      "type": "number",
      "minimum": 0,
      "description": "Environmental or carbon levy for this interval."
    },
    "curtailment_flag": {
      "type": "boolean",
      "description": "Whether generation was curtailed during this interval."
    },
    "curtailment_type": {
      "type": "string",
      "enum": ["congestion", "frequency", "voltage", "instruction", "other"],
      "description": "Reason for curtailment."
    },
    "curtailed_kWh": {
      "type": "number",
      "minimum": 0,
      "description": "Estimated generation lost to curtailment during this interval."
    },
    "curtailment_instruction_id": {
      "type": "string",
      "description": "Reference to the system operator dispatch instruction."
    },
    "balance_responsible_party_id": {
      "type": "string",
      "pattern": "^[a-z0-9._-]+:[a-z0-9._-]+:[a-zA-Z0-9._-]+$",
      "description": "BRP assigned for this connection point and interval."
    },
    "forecast_kWh": {
      "type": "number",
      "description": "Nominated or scheduled volume for this interval."
    },
    "settlement_type": {
      "type": "string",
      "enum": ["bilateral", "sawem_day_ahead", "sawem_intra_day", "balancing", "ancillary"],
      "description": "Market segment for settlement."
    },
    "imbalance_kWh": {
      "type": "number",
      "description": "Difference between forecast and actual (positive = over-delivery, negative = under-delivery)."
    },
    "billing_period": {
      "type": "string",
      "description": "Billing cycle reference (e.g., 2026-02 for monthly, 2026-W07 for weekly)."
    },
    "billed_kWh": {
      "type": "number",
      "minimum": 0,
      "description": "Billed quantity for this interval (may differ from metered kWh)."
    },
    "billing_status": {
      "type": "string",
      "enum": ["metered", "estimated", "adjusted", "disputed"],
      "description": "Data quality or origin of the billed quantity."
    },
    "daa_reference": {
      "type": "string",
      "description": "Distribution Agency Agreement reference if under a DAA with Eskom Distribution."
    },
    "renewable_attribute_id": {
      "type": "string",
      "description": "Certificate or credit identifier (e.g., I-REC tracking number)."
    },
    "certificate_standard": {
      "type": "string",
      "enum": ["i_rec", "rego", "go", "rec", "tigr", "other"],
      "description": "Certificate scheme under which the renewable attribute is issued."
    },
    "verification_status": {
      "type": "string",
      "enum": ["pending", "issued", "retired", "cancelled"],
      "description": "Lifecycle status of the renewable attribute."
    },
    "carbon_intensity_gCO2_per_kWh": {
      "type": "number",
      "minimum": 0,
      "description": "Carbon intensity of the generation source in grams CO2e per kWh."
    },
    "soc": {
      "type": "number",
      "minimum": 0,
      "maximum": 100,
      "description": "Battery state of charge in percent (0-100)"
    },
    "soh": {
      "type": "number",
      "minimum": 0,
      "maximum": 100,
      "description": "Battery state of health in percent (0-100)"
    },
    "charge_kWh": {
      "type": "number",
      "minimum": 0,
      "description": "Energy charged into the battery during this interval, in kilowatt-hours."
    },
    "discharge_kWh": {
      "type": "number",
      "minimum": 0,
      "description": "Energy discharged from the battery during this interval, in kilowatt-hours."
    },
    "cycle_count": {
      "type": "number",
      "minimum": 0,
      "description": "Cumulative number of charge/discharge cycles the battery has completed."
    },
    "cell_temp_min_c": {
      "type": "number",
      "description": "Minimum cell temperature observed during this interval, in degrees Celsius."
    },
    "cell_temp_max_c": {
      "type": "number",
      "description": "Maximum cell temperature observed during this interval, in degrees Celsius."
    },
    "cell_voltage_min_v": {
      "type": "number",
      "minimum": 0,
      "description": "Minimum cell voltage observed during this interval, in volts."
    },
    "cell_voltage_max_v": {
      "type": "number",
      "minimum": 0,
      "description": "Maximum cell voltage observed during this interval, in volts."
    },
    "dispatch_mode": {
      "type": "string",
      "enum": ["charging", "discharging", "standby", "balancing"],
      "description": "Battery dispatch state for this interval."
    },
    "wind_speed_ms": {
      "type": "number",
      "minimum": 0,
      "description": "Wind speed in meters per second."
    },
    "rotor_rpm": {
      "type": "number",
      "minimum": 0,
      "description": "Rotor revolutions per minute."
    },
    "blade_pitch_deg": {
      "type": "number",
      "description": "Blade pitch angle in degrees."
    },
    "nacelle_direction_deg": {
      "type": "number",
      "minimum": 0,
      "maximum": 360,
      "description": "Nacelle orientation in degrees (0-360, compass bearing)."
    }
  },
  "if": {
    "properties": {
      "direction": { "const": "generation" }
    }
  },
  "then": {
    "properties": {
      "kWh": { "minimum": 0 }
    }
  },
  "additionalProperties": false
}
